{
  "authority": "emoji/2.16.0",
  "entries": [
    {
      "code": "AC",
      "kind": "region",
      "sequence": "🇦🇨",
      "token": "[flag:AC]"
    },
    {
      "code": "AD",
      "kind": "region",
      "sequence": "🇦🇩",
      "token": "[flag:AD]"
    },
    {
      "code": "AE",
      "kind": "region",
      "sequence": "🇦🇪",
      "token": "[flag:AE]"
    },
    {
      "code": "AF",
      "kind": "region",
      "sequence": "🇦🇫",
      "token": "[flag:AF]"
    },
    {
      "code": "AG",
      "kind": "region",
      "sequence": "🇦🇬",
      "token": "[flag:AG]"
    },
    {
      "code": "AI",
      "kind": "region",
      "sequence": "🇦🇮",
      "token": "[flag:AI]"
    },
    {
      "code": "AL",
      "kind": "region",
      "sequence": "🇦🇱",
      "token": "[flag:AL]"
    },
    {
      "code": "AM",
      "kind": "region",
      "sequence": "🇦🇲",
      "token": "[flag:AM]"
    },
    {
      "code": "AO",
      "kind": "region",
      "sequence": "🇦🇴",
      "token": "[flag:AO]"
    },
    {
      "code": "AQ",
      "kind": "region",
      "sequence": "🇦🇶",
      "token": "[flag:AQ]"
    },
    {
      "code": "AR",
      "kind": "region",
      "sequence": "🇦🇷",
      "token": "[flag:AR]"
    },
    {
      "code": "AS",
      "kind": "region",
      "sequence": "🇦🇸",
      "token": "[flag:AS]"
    },
    {
      "code": "AT",
      "kind": "region",
      "sequence": "🇦🇹",
      "token": "[flag:AT]"
    },
    {
      "code": "AU",
      "kind": "region",
      "sequence": "🇦🇺",
      "token": "[flag:AU]"
    },
    {
      "code": "AW",
      "kind": "region",
      "sequence": "🇦🇼",
      "token": "[flag:AW]"
    },
    {
      "code": "AX",
      "kind": "region",
      "sequence": "🇦🇽",
      "token": "[flag:AX]"
    },
    {
      "code": "AZ",
      "kind": "region",
      "sequence": "🇦🇿",
      "token": "[flag:AZ]"
    },
    {
      "code": "BA",
      "kind": "region",
      "sequence": "🇧🇦",
      "token": "[flag:BA]"
    },
    {
      "code": "BB",
      "kind": "region",
      "sequence": "🇧🇧",
      "token": "[flag:BB]"
    },
    {
      "code": "BD",
      "kind": "region",
      "sequence": "🇧🇩",
      "token": "[flag:BD]"
    },
    {
      "code": "BE",
      "kind": "region",
      "sequence": "🇧🇪",
      "token": "[flag:BE]"
    },
    {
      "code": "BF",
      "kind": "region",
      "sequence": "🇧🇫",
      "token": "[flag:BF]"
    },
    {
      "code": "BG",
      "kind": "region",
      "sequence": "🇧🇬",
      "token": "[flag:BG]"
    },
    {
      "code": "BH",
      "kind": "region",
      "sequence": "🇧🇭",
      "token": "[flag:BH]"
    },
    {
      "code": "BI",
      "kind": "region",
      "sequence": "🇧🇮",
      "token": "[flag:BI]"
    },
    {
      "code": "BJ",
      "kind": "region",
      "sequence": "🇧🇯",
      "token": "[flag:BJ]"
    },
    {
      "code": "BL",
      "kind": "region",
      "sequence": "🇧🇱",
      "token": "[flag:BL]"
    },
    {
      "code": "BM",
      "kind": "region",
      "sequence": "🇧🇲",
      "token": "[flag:BM]"
    },
    {
      "code": "BN",
      "kind": "region",
      "sequence": "🇧🇳",
      "token": "[flag:BN]"
    },
    {
      "code": "BO",
      "kind": "region",
      "sequence": "🇧🇴",
      "token": "[flag:BO]"
    },
    {
      "code": "BQ",
      "kind": "region",
      "sequence": "🇧🇶",
      "token": "[flag:BQ]"
    },
    {
      "code": "BR",
      "kind": "region",
      "sequence": "🇧🇷",
      "token": "[flag:BR]"
    },
    {
      "code": "BS",
      "kind": "region",
      "sequence": "🇧🇸",
      "token": "[flag:BS]"
    },
    {
      "code": "BT",
      "kind": "region",
      "sequence": "🇧🇹",
      "token": "[flag:BT]"
    },
    {
      "code": "BV",
      "kind": "region",
      "sequence": "🇧🇻",
      "token": "[flag:BV]"
    },
    {
      "code": "BW",
      "kind": "region",
      "sequence": "🇧🇼",
      "token": "[flag:BW]"
    },
    {
      "code": "BY",
      "kind": "region",
      "sequence": "🇧🇾",
      "token": "[flag:BY]"
    },
    {
      "code": "BZ",
      "kind": "region",
      "sequence": "🇧🇿",
      "token": "[flag:BZ]"
    },
    {
      "code": "CA",
      "kind": "region",
      "sequence": "🇨🇦",
      "token": "[flag:CA]"
    },
    {
      "code": "CC",
      "kind": "region",
      "sequence": "🇨🇨",
      "token": "[flag:CC]"
    },
    {
      "code": "CD",
      "kind": "region",
      "sequence": "🇨🇩",
      "token": "[flag:CD]"
    },
    {
      "code": "CF",
      "kind": "region",
      "sequence": "🇨🇫",
      "token": "[flag:CF]"
    },
    {
      "code": "CG",
      "kind": "region",
      "sequence": "🇨🇬",
      "token": "[flag:CG]"
    },
    {
      "code": "CH",
      "kind": "region",
      "sequence": "🇨🇭",
      "token": "[flag:CH]"
    },
    {
      "code": "CI",
      "kind": "region",
      "sequence": "🇨🇮",
      "token": "[flag:CI]"
    },
    {
      "code": "CK",
      "kind": "region",
      "sequence": "🇨🇰",
      "token": "[flag:CK]"
    },
    {
      "code": "CL",
      "kind": "region",
      "sequence": "🇨🇱",
      "token": "[flag:CL]"
    },
    {
      "code": "CM",
      "kind": "region",
      "sequence": "🇨🇲",
      "token": "[flag:CM]"
    },
    {
      "code": "CN",
      "kind": "region",
      "sequence": "🇨🇳",
      "token": "[flag:CN]"
    },
    {
      "code": "CO",
      "kind": "region",
      "sequence": "🇨🇴",
      "token": "[flag:CO]"
    },
    {
      "code": "CP",
      "kind": "region",
      "sequence": "🇨🇵",
      "token": "[flag:CP]"
    },
    {
      "code": "CQ",
      "kind": "region",
      "sequence": "🇨🇶",
      "token": "[flag:CQ]"
    },
    {
      "code": "CR",
      "kind": "region",
      "sequence": "🇨🇷",
      "token": "[flag:CR]"
    },
    {
      "code": "CU",
      "kind": "region",
      "sequence": "🇨🇺",
      "token": "[flag:CU]"
    },
    {
      "code": "CV",
      "kind": "region",
      "sequence": "🇨🇻",
      "token": "[flag:CV]"
    },
    {
      "code": "CW",
      "kind": "region",
      "sequence": "🇨🇼",
      "token": "[flag:CW]"
    },
    {
      "code": "CX",
      "kind": "region",
      "sequence": "🇨🇽",
      "token": "[flag:CX]"
    },
    {
      "code": "CY",
      "kind": "region",
      "sequence": "🇨🇾",
      "token": "[flag:CY]"
    },
    {
      "code": "CZ",
      "kind": "region",
      "sequence": "🇨🇿",
      "token": "[flag:CZ]"
    },
    {
      "code": "DE",
      "kind": "region",
      "sequence": "🇩🇪",
      "token": "[flag:DE]"
    },
    {
      "code": "DG",
      "kind": "region",
      "sequence": "🇩🇬",
      "token": "[flag:DG]"
    },
    {
      "code": "DJ",
      "kind": "region",
      "sequence": "🇩🇯",
      "token": "[flag:DJ]"
    },
    {
      "code": "DK",
      "kind": "region",
      "sequence": "🇩🇰",
      "token": "[flag:DK]"
    },
    {
      "code": "DM",
      "kind": "region",
      "sequence": "🇩🇲",
      "token": "[flag:DM]"
    },
    {
      "code": "DO",
      "kind": "region",
      "sequence": "🇩🇴",
      "token": "[flag:DO]"
    },
    {
      "code": "DZ",
      "kind": "region",
      "sequence": "🇩🇿",
      "token": "[flag:DZ]"
    },
    {
      "code": "EA",
      "kind": "region",
      "sequence": "🇪🇦",
      "token": "[flag:EA]"
    },
    {
      "code": "EC",
      "kind": "region",
      "sequence": "🇪🇨",
      "token": "[flag:EC]"
    },
    {
      "code": "EE",
      "kind": "region",
      "sequence": "🇪🇪",
      "token": "[flag:EE]"
    },
    {
      "code": "EG",
      "kind": "region",
      "sequence": "🇪🇬",
      "token": "[flag:EG]"
    },
    {
      "code": "EH",
      "kind": "region",
      "sequence": "🇪🇭",
      "token": "[flag:EH]"
    },
    {
      "code": "ER",
      "kind": "region",
      "sequence": "🇪🇷",
      "token": "[flag:ER]"
    },
    {
      "code": "ES",
      "kind": "region",
      "sequence": "🇪🇸",
      "token": "[flag:ES]"
    },
    {
      "code": "ET",
      "kind": "region",
      "sequence": "🇪🇹",
      "token": "[flag:ET]"
    },
    {
      "code": "EU",
      "kind": "region",
      "sequence": "🇪🇺",
      "token": "[flag:EU]"
    },
    {
      "code": "FI",
      "kind": "region",
      "sequence": "🇫🇮",
      "token": "[flag:FI]"
    },
    {
      "code": "FJ",
      "kind": "region",
      "sequence": "🇫🇯",
      "token": "[flag:FJ]"
    },
    {
      "code": "FK",
      "kind": "region",
      "sequence": "🇫🇰",
      "token": "[flag:FK]"
    },
    {
      "code": "FM",
      "kind": "region",
      "sequence": "🇫🇲",
      "token": "[flag:FM]"
    },
    {
      "code": "FO",
      "kind": "region",
      "sequence": "🇫🇴",
      "token": "[flag:FO]"
    },
    {
      "code": "FR",
      "kind": "region",
      "sequence": "🇫🇷",
      "token": "[flag:FR]"
    },
    {
      "code": "GA",
      "kind": "region",
      "sequence": "🇬🇦",
      "token": "[flag:GA]"
    },
    {
      "code": "GB",
      "kind": "region",
      "sequence": "🇬🇧",
      "token": "[flag:GB]"
    },
    {
      "code": "GD",
      "kind": "region",
      "sequence": "🇬🇩",
      "token": "[flag:GD]"
    },
    {
      "code": "GE",
      "kind": "region",
      "sequence": "🇬🇪",
      "token": "[flag:GE]"
    },
    {
      "code": "GF",
      "kind": "region",
      "sequence": "🇬🇫",
      "token": "[flag:GF]"
    },
    {
      "code": "GG",
      "kind": "region",
      "sequence": "🇬🇬",
      "token": "[flag:GG]"
    },
    {
      "code": "GH",
      "kind": "region",
      "sequence": "🇬🇭",
      "token": "[flag:GH]"
    },
    {
      "code": "GI",
      "kind": "region",
      "sequence": "🇬🇮",
      "token": "[flag:GI]"
    },
    {
      "code": "GL",
      "kind": "region",
      "sequence": "🇬🇱",
      "token": "[flag:GL]"
    },
    {
      "code": "GM",
      "kind": "region",
      "sequence": "🇬🇲",
      "token": "[flag:GM]"
    },
    {
      "code": "GN",
      "kind": "region",
      "sequence": "🇬🇳",
      "token": "[flag:GN]"
    },
    {